{
  "schema_version": "1.0.0",
  "project_id": "crm-view",
  "screen_id": "customer-view",
  "screen_purpose": "قراءة تفاصيل عميل قابلة للتحديث",
  "has_ui": true,
  "signals": [
    "record_detail"
  ],
  "interaction_signals": [
    "view_record"
  ],
  "languages": [
    "ar-SA",
    "en"
  ],
  "directions": [
    "rtl",
    "ltr"
  ],
  "devices": [
    "desktop",
    "mobile"
  ],
  "tenant_scoped": true,
  "sensitive_data": true,
  "existing_capabilities": [],
  "notes": "قراءة فقط دون Edit أو Unsaved.",
  "risk_level": "medium",
  "data_volume": "small",
  "offline_required": false,
  "composition_signals": [
    "record_workspace"
  ],
  "user_roles": [
    "case-worker"
  ],
  "task_frequency": "regular",
  "information_density": "adaptive",
  "viewport_priority": "balanced",
  "primary_input": "mixed",
  "journey_signals": [],
  "entry_channel": "internal-navigation",
  "completion_expectation": "unknown",
  "context_continuity": "task-scoped"
}
